,Name,Payment_history,Financial_circumstances,Communication,Credit_worthiness
0,Albert Einstein,Albert has a history of late payments and defaults on his loans. He has consistently missed due dates and often fails to make the minimum required payments. His payment behavior suggests a high risk of default and a lack of financial responsibility.,"Albert's financial situation is unstable. He has a history of frequent job changes and irregular income. His expenses often exceed his income, leading to a persistent negative cash flow. Albert has also accumulated significant credit card debt, indicating a pattern of overspending.",Past loan agents have reported difficulty in communicating with Albert. He tends to avoid conversations about his financial obligations and has been unresponsive to collection efforts. Albert's lack of engagement and willingness to cooperate negatively impacts his creditworthiness.,"Based on the information available, Albert is considered a high-risk borrower with low creditworthiness. His negative payment history, unstable financial circumstances, and poor communication record suggest a strong likelihood of default. Lenders should exercise caution when considering extending credit to Albert."
1,Marie Curie,Marie has a history of late payments and defaults on her loans. She has frequently missed payments and has had her accounts sent to collections multiple times. Her payment behavior indicates a high risk of default.,"Marie's financial situation is unstable. She has a low and unpredictable income, with frequent periods of unemployment. Her expenses often exceed her income, leading to a consistent negative cash flow. She has little to no savings or assets to fall back on.",Marie has been difficult to reach and unresponsive to past loan agents' attempts to communicate. She has missed several appointments and has not returned calls or emails. Her lack of cooperation and willingness to communicate is a concern.,Marie has a low credit score and a thin credit file. Her credit history shows multiple delinquencies and charge-offs. She has a high debt-to-income ratio and has maxed out her credit limits. Marie's creditworthiness is considered very poor.
2,Martin Luther King Jr.,There is a record of consistent late payments and default on previous loans. Multiple instances of delinquent behavior with no signs of improvement.,"The subject has a history of unstable income and high expenses. Financial instability is evident, with a negative net worth and insufficient assets to cover liabilities.",Past loan agents have reported a lack of cooperation and responsiveness. The borrower has been evasive and provided incomplete or misleading information during communications.,"Low creditworthiness due to a poor credit score, delinquent behavior, and a history of default. High risk of default and unfavorable payment behavior."
3,Mahatma Gandhi,"There is a record of consistent late payments and default on previous loans. Gandhi has a history of irregular employment, which has led to an unstable income and subsequent payment delays.","Gandhi's financial situation is precarious due to their unpredictable income sources. There is a high risk of financial strain and an inability to meet basic living expenses, let alone loan repayments.","Past loan agents have reported difficulty in communicating with Gandhi. There is a lack of response to repayment reminders, and the borrower has shown a general unwillingness to cooperate with lenders.","Gandhi has a low credit score due to their negative payment history and unstable financial circumstances. Their creditworthiness is considered very poor, and they pose a significant risk to lenders."
4,Isaac Newton,Isaac has a history of late payments and defaults on his loans. He has frequently missed due dates and often fails to make the minimum required payments. His payment behavior suggests a high risk of future delinquency.,"Isaac's financial situation appears unstable. He has a history of irregular income and high expenses, with frequent overdrafts on his accounts. His financial statements indicate a pattern of financial strain and potential insolvency.",Past loan agents have reported difficulty in communicating with Isaac. He has been unresponsive to collection efforts and has a history of avoiding direct communication. His lack of cooperation and willingness to resolve issues is concerning.,"Based on the information available, Isaac's creditworthiness is considered low. His payment history, financial circumstances, and communication record indicate a high risk of default and potential financial instability."
5,Leonardo da Vinci,Leonardo has a history of late payments and defaults. He has consistently missed due dates on his loans and has had his accounts sent to collections on multiple occasions. His payment behavior indicates a high risk of default.,"Leonardo's financial situation is unstable. He has a history of irregular income and high expenses. His bank statements show frequent overdrafts and insufficient funds, suggesting a lack of financial management skills.",Past loan agents have reported difficulty in communicating with Leonardo. He has been unresponsive to their attempts to reach out and discuss his loan terms and repayment options. Leonardo's lack of cooperation and willingness to engage raises concerns about his commitment to fulfilling his financial obligations.,"Based on the information available, Leonardo's creditworthiness is low. His payment history, financial circumstances, and communication record indicate a high risk of default and potential financial instability. Lenders should exercise caution when considering extending credit to this individual."
6,Nelson Mandela,Nelson has a history of late payments and defaults on loans. He has frequently missed due dates and has had to negotiate repayment plans with lenders.,"Nelson's financial situation is unstable. He has a low and unpredictable income, with frequent periods of unemployment. He has high existing debt and has filed for bankruptcy in the past.",Past loan agents have reported difficulty in communicating with Nelson. He has been unresponsive to their attempts to reach out and has not provided the necessary documentation in a timely manner.,"Based on the information available, Nelson is considered a high-risk borrower with low creditworthiness. His history of late payments, defaults, and financial instability suggests a low likelihood of repaying loans on time."
7,Stephen Hawking,There is a record of missed payments and frequent delays in payment history. Stephen has a history of defaulting on loans and has been reluctant to prioritize debt repayment.,"Stephen's financial situation is unstable due to unpredictable income sources. He has high outstanding debt and faces challenges in managing his expenses, often relying on credit to make ends meet.",Past loan agents have reported difficulty in communicating with Stephen. He tends to avoid discussions about his financial situation and has been uncooperative in providing necessary documentation for loan assessments.,"Based on the information available, Stephen's creditworthiness is low. His history of missed payments and defaulting on loans indicates a high risk of default. Lenders should exercise caution when considering extending credit to him."
8,Anne Frank,Anne has a history of late payments and defaults. She has frequently missed due dates and often needed extensions or special arrangements.,"Her financial situation is unstable. She has a history of irregular income, and her expenses often exceed her earnings, resulting in a consistent negative cash flow.",Past loan agents have reported difficulty in communicating with Anne. She tends to avoid discussions about her financial situation and has been uncooperative in providing necessary documentation.,"Based on the information available, Anne's creditworthiness is low. Her payment history, financial circumstances, and communication record indicate a high risk of default and potential financial instability."
9,Rosa Parks,Rosa has a history of late payments and defaults on previous loans. She has shown a consistent pattern of missing payment due dates and has had multiple accounts sent to collections.,"Rosa's financial situation appears unstable. She has a low and unpredictable income, with frequent gaps in employment. Her expenses often exceed her income, leading to a negative cash flow.",Past loan agents have reported difficulty in communicating with Rosa. She has been unresponsive to their attempts to reach out and discuss repayment plans. Rosa has also been evasive when asked to provide documentation and information regarding her financial situation.,"Based on the information available, Rosa's creditworthiness is low. Her payment history, financial circumstances, and communication record indicate a high risk of default. Lenders should exercise caution when considering extending credit to her."
10,Olivia,Olivia has a good payment history with no late or missed payments. She has consistently made on-time payments towards her credit card and loan obligations.,She has a stable financial situation with a consistent income source. Her expenses are well-managed and she maintains a healthy balance between her earnings and spending.,"In her past communications with loan agents, Olivia has been cooperative and responsive. She has provided all the necessary documentation and information in a timely manner, demonstrating a responsible and willing attitude.","Based on her payment history and financial circumstances, Olivia can be considered creditworthy. She has a good track record of repaying her debts and her financial situation indicates a low risk of default."
11,Emma,"Emma has a strong payment history, with no late or missed payments in the past two years. She has consistently made on-time payments towards her credit card, loan, and utility bills.","Emma works as a software engineer with a stable income. Her monthly income is sufficient to cover her expenses, including rent, utilities, transportation, and entertainment. She has a healthy savings account and invests a portion of her income regularly.","In the past, Emma has been responsive and cooperative during loan applications and financial discussions. She has proactively provided the necessary documentation and has been transparent about her financial situation. Emma is open to communication via email, phone, or in-person meetings.","Based on the information available, Emma has a high creditworthiness score. Her strong payment history, stable income, and responsible financial management demonstrate a low risk of default. She has a good mix of credit accounts and a long credit history, indicating her ability to handle various types of credit responsibly."
12,Liam,Liam has a good payment history with no late or missed payments. He has consistently made on-time payments towards his credit card and loan obligations.,"Liam is currently employed with a stable income. He has a healthy balance between his debt and income, indicating a responsible management of finances. Liam also has a reasonable amount of savings, which can be used in case of emergencies.",Liam has been cooperative and responsive during the loan application process. He promptly provided the necessary documentation and was transparent about his financial situation. Liam is open to communication and has a clear understanding of the loan terms and conditions.,"Based on the information provided, Liam can be considered creditworthy. He has a good credit score, a positive payment history, and a stable financial situation. There are no significant concerns that would indicate a high credit risk. Liam's overall profile suggests that he is likely to meet his financial commitments in a timely manner."
13,Noah,Noah has a good payment history with no late or missed payments. He has consistently made on-time payments for his previous loans and credit card bills.,"Noah is currently employed with a stable income. He has a healthy balance between his debt and income, and his overall financial situation seems secure. Noah has a history of responsible borrowing and has managed his finances well.",Past loan agents report that Noah has been responsive and cooperative during the loan process. He has provided all the necessary documentation in a timely manner and has been transparent about his financial situation. Noah is willing to communicate and work with the lender to ensure timely repayments.,"Based on the information available, Noah is considered to have high creditworthiness. His consistent payment history, stable financial circumstances, and responsible borrowing behavior indicate a low-risk borrower. Noah is likely to be eligible for favorable loan terms and interest rates."
14,Ava,"Ava has a good payment history with no late or missed payments in the past two years. She has consistently made on-time payments towards her credit card, loan, and utility bills.","Ava is currently employed with a stable income. She has a healthy balance between her debt and income, and her overall financial situation appears positive with no recent negative marks on her record.","In the past, Ava has been responsive and cooperative during loan applications and payments. She has a good understanding of financial processes and is willing to provide necessary information when required.","Based on the information available, Ava can be considered creditworthy. Her consistent payment history, stable financial circumstances, and positive communication record indicate a low-risk profile."
15,Elijah,Elijah has a good payment history with no late or missed payments. He has consistently made on-time payments for his previous loans and credit card bills.,"Elijah is currently employed with a stable income. He has a healthy balance between his debt and income, and his overall financial situation seems secure. Elijah has a history of responsible borrowing and has never defaulted on any loans.","Past loan agents report that Elijah is cooperative and responsive during the loan process. He has always been willing to provide additional information and documents when needed. Elijah is also prompt in returning calls and emails, making the communication smooth and efficient.","Based on the information available, Elijah has a high creditworthiness. His timely payments, stable financial circumstances, and positive communication history indicate a low-risk borrower profile. Elijah is likely to be eligible for favorable loan terms and interest rates."
16,Charlotte,Charlotte has a good payment history with no late or missed payments. She has consistently made on-time payments towards her credit card and loan obligations.,"Charlotte's financial circumstances are stable. She has a steady income from her full-time employment and manages her expenses well. Charlotte has a healthy balance between her debt and income, with no significant financial stressors observed.","Past loan agents have reported positive communication with Charlotte. She is responsive, provides the necessary documentation in a timely manner, and is cooperative during the loan process. Charlotte has a clear understanding of her financial commitments.","Charlotte has a high credit score, indicating strong creditworthiness. Her credit report shows a responsible borrowing history with no delinquent accounts. Charlotte's credit utilization is low, and she has a good mix of credit types, including a mortgage, credit cards, and an auto loan."
17,Amelia,Amelia has a good payment history with no late or missed payments. She has consistently made on-time payments towards her credit card and loan obligations.,Amelia works as a software engineer with a stable income. Her monthly income is sufficient to cover her expenses and debt obligations. She has a healthy balance between her current assets and liabilities.,Amelia has been cooperative and responsive during the loan application process. She provided all the required documentation in a timely manner and was transparent about her financial situation. Amelia is willing to discuss any concerns and has been easy to reach.,"Based on the information provided, Amelia has a high creditworthiness. Her consistent payment history, stable employment, and strong financial profile indicate a low risk of default. She is likely to have a good credit score and a positive credit history."
18,William,William has a good payment history with no late or missed payments in the past two years. He has consistently made on-time payments towards his credit card and loan obligations.,"William's financial circumstances are stable. He has a steady income from his full-time employment and manages his expenses well. William has a healthy balance between his debt and income, with no significant financial stressors observed.",William has been cooperative and responsive in past communications with loan agents. He has provided all the necessary documentation in a timely manner and has been transparent about his financial situation. William is willing to discuss repayment plans and has a good understanding of his loan obligations.,"William has a high credit score, indicating that he is a low-risk borrower. His credit history shows responsible use of credit with no recent derogatory marks. William's creditworthiness is further supported by his stable employment and positive payment history."
19,James,James has a good payment history with no late or missed payments. He has consistently made on-time payments towards his credit card and loan obligations.,"James is currently employed with a stable income. He has a healthy balance between his debt and income, indicating a responsible management of finances. James' bank statements show regular deposits and no overdrafts.",Past loan agents have reported James to be responsive and cooperative during the loan process. He has been transparent about his financial situation and has provided all the necessary documentation in a timely manner.,"Based on the information available, James can be considered creditworthy. He has a good credit score, a positive payment history, and a stable financial situation. James is likely to be a low-risk borrower."
